{
  "$schema": "./producer-gates.schema.json",
  "schemaVersion": 2,
  "catalogue": {
    "historicalCatalogueSha256": "3dbec1f7d8a81ee807b58b5ff3a45eb0d4061ebe0069b87a8bb208d43fec6741",
    "policySha256": "bd508134f9d2f44e970663b56b54777cc254f50270d8ca92265f222b3c23fe25",
    "sourcePaths": [
      "docs/implementation-plan.md",
      "docs/plans/java-api-parity-precondition.md",
      "docs/ontology-lifecycle-capability-implementation-plan.md",
      "docs/release/producer-release-policy.json"
    ]
  },
  "policy": {
    "successfulFinalResults": [
      "PASS",
      "NOT_APPLICABLE"
    ],
    "failureClasses": [
      "PRODUCT_FAILURE",
      "CONTROL_FAILURE",
      "EXTERNAL_BLOCKED"
    ],
    "transientDiagnosticResult": "INFRASTRUCTURE_ERROR",
    "waiverPolicy": "NO_ORDINARY_WAIVER"
  },
  "requirements": [
    {
      "requirementId": "P19-PRODUCER-SCOPE-001",
      "phase": 19,
      "sourceAnchor": "p19-producer-scope-001",
      "requirementDigest": "sha256:1c99c9d8fac87a4de2ac76f13da41d2643064a95da02bfb936df10df591e3f89",
      "checkpoint": "19C",
      "prerequisiteRequirementIds": [],
      "owner": "PACKAGE_MAINTAINER",
      "applicability": {
        "mode": "ALWAYS"
      },
      "blocking": "REQUIRED",
      "verification": {
        "kind": "HYBRID",
        "command": "npm run qualify:release -- --requirement P19-PRODUCER-SCOPE-001"
      },
      "evidence": {
        "recordPath": "docs/provenance/releases/<version>/gates.json",
        "jsonPointer": "/requirements/P19-PRODUCER-SCOPE-001"
      },
      "permittedFinalResults": [
        "PASS"
      ],
      "failureClasses": [
        "PRODUCT_FAILURE",
        "CONTROL_FAILURE",
        "EXTERNAL_BLOCKED"
      ],
      "waiverPolicy": "NO_ORDINARY_WAIVER",
      "childGateIds": [
        "P19-PRODUCER-SCOPE-001-VERIFY"
      ]
    },
    {
      "requirementId": "P19-HISTORY-001",
      "phase": 19,
      "sourceAnchor": "p19-history-001",
      "requirementDigest": "sha256:3843fb8c09af2b4b3f71dff2516bcf2b61aba971c39c65423da7c4e10ccca60c",
      "checkpoint": "19A",
      "prerequisiteRequirementIds": [],
      "owner": "HISTORY_CUSTODIAN",
      "applicability": {
        "mode": "ALWAYS"
      },
      "blocking": "REQUIRED",
      "verification": {
        "kind": "HUMAN_REVIEW",
        "command": "npm run qualify:release -- --requirement P19-HISTORY-001"
      },
      "evidence": {
        "recordPath": "docs/provenance/releases/<version>/gates.json",
        "jsonPointer": "/requirements/P19-HISTORY-001"
      },
      "permittedFinalResults": [
        "PASS"
      ],
      "failureClasses": [
        "PRODUCT_FAILURE",
        "CONTROL_FAILURE",
        "EXTERNAL_BLOCKED"
      ],
      "waiverPolicy": "NO_ORDINARY_WAIVER",
      "childGateIds": [
        "P19-HISTORY-001-VERIFY"
      ]
    },
    {
      "requirementId": "P19-REPOSITORY-001",
      "phase": 19,
      "sourceAnchor": "p19-repository-001",
      "requirementDigest": "sha256:b06177f592379edb46e468366441f8ae444a55963d9c3bcff97938c3d47c8eb0",
      "checkpoint": "19B",
      "prerequisiteRequirementIds": [],
      "owner": "REPOSITORY_ADMINISTRATOR",
      "applicability": {
        "mode": "ALWAYS"
      },
      "blocking": "REQUIRED",
      "verification": {
        "kind": "EXTERNAL_OBSERVATION",
        "command": "npm run qualify:release -- --requirement P19-REPOSITORY-001"
      },
      "evidence": {
        "recordPath": "docs/provenance/releases/<version>/gates.json",
        "jsonPointer": "/requirements/P19-REPOSITORY-001"
      },
      "permittedFinalResults": [
        "PASS"
      ],
      "failureClasses": [
        "PRODUCT_FAILURE",
        "CONTROL_FAILURE",
        "EXTERNAL_BLOCKED"
      ],
      "waiverPolicy": "NO_ORDINARY_WAIVER",
      "childGateIds": [
        "P19-REPOSITORY-001-VERIFY"
      ]
    },
    {
      "requirementId": "P19-RIGHTS-001",
      "phase": 19,
      "sourceAnchor": "p19-rights-001",
      "requirementDigest": "sha256:c4a7cefb06a442e13e6e433eb9a24583a0d200b0742e80b534d3508058c0a7e8",
      "checkpoint": "19B",
      "prerequisiteRequirementIds": [],
      "owner": "RIGHTS_REVIEWER",
      "applicability": {
        "mode": "ALWAYS"
      },
      "blocking": "REQUIRED",
      "verification": {
        "kind": "HUMAN_REVIEW",
        "command": "npm run qualify:release -- --requirement P19-RIGHTS-001"
      },
      "evidence": {
        "recordPath": "docs/provenance/releases/<version>/gates.json",
        "jsonPointer": "/requirements/P19-RIGHTS-001"
      },
      "permittedFinalResults": [
        "PASS"
      ],
      "failureClasses": [
        "PRODUCT_FAILURE",
        "CONTROL_FAILURE",
        "EXTERNAL_BLOCKED"
      ],
      "waiverPolicy": "NO_ORDINARY_WAIVER",
      "childGateIds": [
        "P19-RIGHTS-001-VERIFY"
      ]
    },
    {
      "requirementId": "P19-PACKAGE-001",
      "phase": 19,
      "sourceAnchor": "p19-package-001",
      "requirementDigest": "sha256:1499fd2d6d1c4e0eceec8bbfa9062d893e0a59aef30ae11024d7402152f170a2",
      "checkpoint": "19C",
      "prerequisiteRequirementIds": [],
      "owner": "PACKAGE_MAINTAINER",
      "applicability": {
        "mode": "ALWAYS"
      },
      "blocking": "REQUIRED",
      "verification": {
        "kind": "AUTOMATED",
        "command": "npm run qualify:release -- --requirement P19-PACKAGE-001"
      },
      "evidence": {
        "recordPath": "docs/provenance/releases/<version>/gates.json",
        "jsonPointer": "/requirements/P19-PACKAGE-001"
      },
      "permittedFinalResults": [
        "PASS"
      ],
      "failureClasses": [
        "PRODUCT_FAILURE",
        "CONTROL_FAILURE",
        "EXTERNAL_BLOCKED"
      ],
      "waiverPolicy": "NO_ORDINARY_WAIVER",
      "childGateIds": [
        "P19-PACKAGE-001-VERIFY"
      ]
    },
    {
      "requirementId": "P19-DEPENDENCIES-001",
      "phase": 19,
      "sourceAnchor": "p19-dependencies-001",
      "requirementDigest": "sha256:53784246285e05cff1c17bfd770695bcce7e39d3c425bd8f3c5f57499391438a",
      "checkpoint": "19C",
      "prerequisiteRequirementIds": [],
      "owner": "DEPENDENCY_MAINTAINER",
      "applicability": {
        "mode": "ALWAYS"
      },
      "blocking": "REQUIRED",
      "verification": {
        "kind": "AUTOMATED",
        "command": "npm run qualify:release -- --requirement P19-DEPENDENCIES-001"
      },
      "evidence": {
        "recordPath": "docs/provenance/releases/<version>/gates.json",
        "jsonPointer": "/requirements/P19-DEPENDENCIES-001"
      },
      "permittedFinalResults": [
        "PASS"
      ],
      "failureClasses": [
        "PRODUCT_FAILURE",
        "CONTROL_FAILURE",
        "EXTERNAL_BLOCKED"
      ],
      "waiverPolicy": "NO_ORDINARY_WAIVER",
      "childGateIds": [
        "P19-DEPENDENCIES-001-VERIFY"
      ]
    },
    {
      "requirementId": "P19-PRODUCER-DOCUMENTATION-001",
      "phase": 19,
      "sourceAnchor": "p19-producer-documentation-001",
      "requirementDigest": "sha256:67cf349719833711c1b40c58459c1c3af148e82c698935d49e0206f1d1b923d4",
      "checkpoint": "19C",
      "prerequisiteRequirementIds": [],
      "owner": "PACKAGE_MAINTAINER",
      "applicability": {
        "mode": "ALWAYS"
      },
      "blocking": "REQUIRED",
      "verification": {
        "kind": "HYBRID",
        "command": "npm run qualify:release -- --requirement P19-PRODUCER-DOCUMENTATION-001"
      },
      "evidence": {
        "recordPath": "docs/provenance/releases/<version>/gates.json",
        "jsonPointer": "/requirements/P19-PRODUCER-DOCUMENTATION-001"
      },
      "permittedFinalResults": [
        "PASS"
      ],
      "failureClasses": [
        "PRODUCT_FAILURE",
        "CONTROL_FAILURE",
        "EXTERNAL_BLOCKED"
      ],
      "waiverPolicy": "NO_ORDINARY_WAIVER",
      "childGateIds": [
        "P19-PRODUCER-DOCUMENTATION-001-VERIFY"
      ]
    },
    {
      "requirementId": "P19-SECURITY-GOVERNANCE-001",
      "phase": 19,
      "sourceAnchor": "p19-security-governance-001",
      "requirementDigest": "sha256:d5c442f09760a3d250b7e9696c6648024b45c418801d5da8d63505df2ae36532",
      "checkpoint": "19C",
      "prerequisiteRequirementIds": [],
      "owner": "SECURITY_MAINTAINER",
      "applicability": {
        "mode": "ALWAYS"
      },
      "blocking": "REQUIRED",
      "verification": {
        "kind": "HYBRID",
        "command": "npm run qualify:release -- --requirement P19-SECURITY-GOVERNANCE-001"
      },
      "evidence": {
        "recordPath": "docs/provenance/releases/<version>/gates.json",
        "jsonPointer": "/requirements/P19-SECURITY-GOVERNANCE-001"
      },
      "permittedFinalResults": [
        "PASS"
      ],
      "failureClasses": [
        "PRODUCT_FAILURE",
        "CONTROL_FAILURE",
        "EXTERNAL_BLOCKED"
      ],
      "waiverPolicy": "NO_ORDINARY_WAIVER",
      "childGateIds": [
        "P19-SECURITY-GOVERNANCE-001-VERIFY"
      ]
    },
    {
      "requirementId": "P19-LOCKED-TOOLCHAIN-001",
      "phase": 19,
      "sourceAnchor": "p19-locked-toolchain-001",
      "requirementDigest": "sha256:2a1e589c0a9af154aa49a61b6b67650ad07e9479ab7c2b803c0bc74a55c6cf28",
      "checkpoint": "19C",
      "prerequisiteRequirementIds": [],
      "owner": "PACKAGE_MAINTAINER",
      "applicability": {
        "mode": "ALWAYS"
      },
      "blocking": "REQUIRED",
      "verification": {
        "kind": "HYBRID",
        "command": "npm run qualify:release -- --requirement P19-LOCKED-TOOLCHAIN-001"
      },
      "evidence": {
        "recordPath": "docs/provenance/releases/<version>/gates.json",
        "jsonPointer": "/requirements/P19-LOCKED-TOOLCHAIN-001"
      },
      "permittedFinalResults": [
        "PASS"
      ],
      "failureClasses": [
        "PRODUCT_FAILURE",
        "CONTROL_FAILURE",
        "EXTERNAL_BLOCKED"
      ],
      "waiverPolicy": "NO_ORDINARY_WAIVER",
      "childGateIds": [
        "P19-LOCKED-TOOLCHAIN-001-VERIFY"
      ]
    },
    {